{
  "$schema": "http://json-schema.org/draft-07/schema#",
  "$id": "https://swoff.ai/schema/v1.json",
  "title": "Swoff Configuration",
  "description": "Configuration for the Swoff offline-first service worker system",
  "type": "object",
  "properties": {
    "$schema": {
      "type": "string",
      "description": "Reference to the schema version",
      "example": "https://swoff.ai/schema/v1.json"
    },
    "enabled": {
      "type": "boolean",
      "description": "Enable or disable config-driven generation",
      "default": true
    },
    "version": {
      "type": "string",
      "description": "Service Worker version source",
      "default": "from-package",
      "enum": ["from-package"],
      "pattern": "^\\d+\\.\\d+\\.\\d+$"
    },
    "minSupportedVersion": {
      "type": "string",
      "description": "Minimum supported version for forced updates",
      "default": "0.0.0",
      "pattern": "^\\d+\\.\\d+\\.\\d+$"
    },
    "serviceWorker": {
      "type": "object",
      "description": "Service Worker configuration",
      "properties": {
        "autoUpdate": {
          "type": "boolean",
          "description": "Auto-update behavior - true = silent update, false = show update prompt",
          "default": false
        },
        "defaultStrategy": {
          "type": "string",
          "description": "Default caching strategy for all requests",
          "default": "cache-first",
          "enum": ["cache-first", "network-first", "stale-while-revalidate", "cache-only", "network-only"]
        },
        "strategies": {
          "type": "object",
          "description": "Custom cache strategies for specific URL patterns",
          "additionalProperties": {
            "type": "string",
            "enum": ["cache-first", "network-first", "stale-while-revalidate", "cache-only", "network-only"]
          },
          "patternProperties": {
            ".*": {
              "type": "string"
            }
          }
        },
        "maxCacheEntries": {
          "type": "integer",
          "description": "Maximum number of cached entries",
          "default": 100,
          "minimum": 1
        },
        "maxCacheAge": {
          "type": "integer",
          "description": "Maximum age of cached entries in milliseconds",
          "default": 604800000,
          "minimum": 1000
        },
        "runtimeCacheName": {
          "type": "string",
          "description": "Custom runtime cache name",
          "default": "swoff-runtime",
          "pattern": "^[a-zA-Z0-9-_]+$"
        }
      },
      "required": ["autoUpdate", "defaultStrategy", "maxCacheEntries", "maxCacheAge", "runtimeCacheName"]
    },
    "features": {
      "type": "object",
      "description": "Feature toggles - enable/disable specific functionality",
      "properties": {
        "versionedSw": {
          "type": "boolean",
          "description": "Enable versioned service worker (prevents silent updates)",
          "default": true
        },
        "offlineReads": {
          "type": "boolean",
          "description": "Cache API responses for offline read access",
          "default": true
        },
        "mutationQueue": {
          "type": "boolean",
          "description": "Queue offline writes and sync when back online",
          "default": false
        },
        "backgroundSync": {
          "type": "boolean",
          "description": "Enable Background Sync API (Chrome/Edge only)",
          "default": false
        },
        "pwa": {
          "type": "boolean",
          "description": "Enable PWA installability (manifest handling should be done separately)",
          "default": true
        },
        "auth": {
          "type": "boolean",
          "description": "Enable auth integration",
          "default": false
        },
        "crossTabSync": {
          "type": "boolean",
          "description": "Cross-tab cache invalidation sync",
          "default": true
        },
        "tagInvalidation": {
          "type": "boolean",
          "description": "Tag-based cache invalidation",
          "default": true
        }
      },
      "required": ["versionedSw", "offlineReads", "mutationQueue", "backgroundSync", "pwa", "auth", "crossTabSync", "tagInvalidation"]
    },
    "database": {
      "type": "object",
      "description": "IndexedDB configuration",
      "properties": {
        "name": {
          "type": "string",
          "description": "Database name",
          "default": "app-db",
          "pattern": "^[a-zA-Z0-9-_]+$"
        },
        "stores": {
          "type": "array",
          "description": "Object store names (user defines their own schema)",
          "items": {
            "type": "string",
            "pattern": "^[a-zA-Z0-9-_]+$"
          },
          "default": []
        }
      },
      "required": ["name"]
    },
    "build": {
      "type": "object",
      "description": "Build output configuration",
      "properties": {
        "outputDir": {
          "type": "string",
          "description": "Output directory for generated files",
          "default": "dist",
          "pattern": "^[^/\\\\]+$"
        },
        "swFilename": {
          "type": "string",
          "description": "Service worker output filename (without version)",
          "default": "sw",
          "pattern": "^[a-zA-Z0-9-_]+$"
        }
      },
      "required": ["outputDir", "swFilename"]
    }
  },
  "required": ["enabled", "version", "minSupportedVersion", "serviceWorker", "features", "build"],
  "additionalProperties": false
}